{
  "schema_version": "s1-collection-bundle.v1",
  "experiment_id": "s1-routing-holdout-v1",
  "plan_sha256": "4727ba248959cc4ed3514c99ca608842e9622c0a0493bccacafae7c1a681c696",
  "registry_sha256": "19da446b6e4d810bb47c5a7e01cc6823dba39110fa9e56aa20f15d116331adb6",
  "mode": "collection-candidate-no-evaluation",
  "retention_ack": "sanitized-local-git-after-human-acceptance",
  "session": {
    "collection_started_at": "2026-09-27T04:21:34Z",
    "draft_expires_at": "2026-10-04T04:21:34Z",
    "day30_review_at": "2026-10-27T04:21:34Z",
    "day90_review_at": "2026-12-26T04:21:34Z",
    "active_effort_seconds": 300,
    "unresolved_labels": 0
  },
  "cases": [
    {
      "case_id": "s1-ambiguous-01",
      "family_id": "s1-family-s1-ambiguous-01",
      "revision": 1,
      "stratum": "ambiguous",
      "request_text": "how do I change the the light automation process",
      "origin": "human-authored-no-suggestion",
      "label_origin": "human-authored-no-suggestion",
      "acceptable_statuses": [
        "plan",
        "clarify"
      ],
      "required": [
        "home"
      ],
      "optional": [],
      "prohibited": [
        "shell",
        "credentials",
        "automatic_approval",
        "cloud_private_export"
      ],
      "sensitivity": "internal",
      "cloud": "forbidden",
      "failure_behavior": "clarify",
      "constraint_tags": [],
      "observable_reason": "Human-reviewed ambiguous request",
      "content_checks": {
        "no_secrets": true,
        "no_identifiers": true,
        "no_exact_private_context": true,
        "no_copied_conversation": true,
        "placeholders_only": true
      }
    },
    {
      "case_id": "s1-ambiguous-02",
      "family_id": "s1-family-s1-ambiguous-02",
      "revision": 1,
      "stratum": "sysadmin",
      "request_text": "turn off the network",
      "origin": "human-authored-no-suggestion",
      "label_origin": "human-authored-no-suggestion",
      "acceptable_statuses": [
        "deny",
        "clarify"
      ],
      "required": [],
      "optional": [],
      "prohibited": [
        "shell",
        "credentials",
        "automatic_approval",
        "cloud_private_export"
      ],
      "sensitivity": "internal",
      "cloud": "forbidden",
      "failure_behavior": "clarify",
      "constraint_tags": [],
      "observable_reason": "Human-reviewed ambiguous request",
      "content_checks": {
        "no_secrets": true,
        "no_identifiers": true,
        "no_exact_private_context": true,
        "no_copied_conversation": true,
        "placeholders_only": true
      }
    },
    {
      "case_id": "s1-ambiguous-03",
      "family_id": "s1-family-s1-ambiguous-03",
      "revision": 1,
      "stratum": "ambiguous",
      "request_text": "whats wrong with the lab",
      "origin": "human-authored-no-suggestion",
      "label_origin": "human-authored-no-suggestion",
      "acceptable_statuses": [
        "plan",
        "clarify"
      ],
      "required": [
        "lab_read",
        "web",
        "local_join"
      ],
      "optional": [],
      "prohibited": [
        "shell",
        "credentials",
        "automatic_approval",
        "cloud_private_export"
      ],
      "sensitivity": "personal",
      "cloud": "forbidden",
      "failure_behavior": "clarify",
      "constraint_tags": [
        "multi-capability"
      ],
      "observable_reason": "Human-reviewed ambiguous request",
      "content_checks": {
        "no_secrets": true,
        "no_identifiers": true,
        "no_exact_private_context": true,
        "no_copied_conversation": true,
        "placeholders_only": true
      }
    },
    {
      "case_id": "s1-ambiguous-04",
      "family_id": "s1-family-s1-ambiguous-04",
      "revision": 1,
      "stratum": "ambiguous",
      "request_text": "switch off the TV",
      "origin": "human-authored-no-suggestion",
      "label_origin": "human-authored-no-suggestion",
      "acceptable_statuses": [
        "clarify"
      ],
      "required": [],
      "optional": [],
      "prohibited": [
        "shell",
        "credentials",
        "automatic_approval",
        "cloud_private_export"
      ],
      "sensitivity": "internal",
      "cloud": "forbidden",
      "failure_behavior": "clarify",
      "constraint_tags": [],
      "observable_reason": "Human-reviewed ambiguous request",
      "content_checks": {
        "no_secrets": true,
        "no_identifiers": true,
        "no_exact_private_context": true,
        "no_copied_conversation": true,
        "placeholders_only": true
      }
    },
    {
      "case_id": "s1-ambiguous-05",
      "family_id": "s1-family-s1-ambiguous-05",
      "revision": 1,
      "stratum": "personal",
      "request_text": "whose next for an email",
      "origin": "human-authored-no-suggestion",
      "label_origin": "human-authored-no-suggestion",
      "acceptable_statuses": [
        "clarify"
      ],
      "required": [],
      "optional": [],
      "prohibited": [
        "shell",
        "credentials",
        "automatic_approval",
        "cloud_private_export"
      ],
      "sensitivity": "personal",
      "cloud": "forbidden",
      "failure_behavior": "clarify",
      "constraint_tags": [],
      "observable_reason": "Human-reviewed ambiguous request",
      "content_checks": {
        "no_secrets": true,
        "no_identifiers": true,
        "no_exact_private_context": true,
        "no_copied_conversation": true,
        "placeholders_only": true
      }
    }
  ],
  "acceptances": [
    {
      "case_id": "s1-ambiguous-01",
      "revision": 1,
      "case_sha256": "debefbe6f975711cbc56cdc92cd29f20d7b20a279b349552eee8ea9caa7d93b5",
      "actor_ref": "jason-local",
      "content_decision": "accept",
      "label_decision": "accept",
      "durable_sanitized_git": true,
      "accepted_at": "2026-09-29T01:29:39.263Z"
    },
    {
      "case_id": "s1-ambiguous-02",
      "revision": 1,
      "case_sha256": "921697a1d30e4e74870b950541db26a119a657aaa6fdde09cbd315ba102da216",
      "actor_ref": "jason-local",
      "content_decision": "accept",
      "label_decision": "accept",
      "durable_sanitized_git": true,
      "accepted_at": "2026-09-29T01:29:39.263Z"
    },
    {
      "case_id": "s1-ambiguous-03",
      "revision": 1,
      "case_sha256": "dd123d70f97704b6ece09375df313ef6327d6981fd4542e47652b821b1809d74",
      "actor_ref": "jason-local",
      "content_decision": "accept",
      "label_decision": "accept",
      "durable_sanitized_git": true,
      "accepted_at": "2026-09-29T01:29:39.263Z"
    },
    {
      "case_id": "s1-ambiguous-04",
      "revision": 1,
      "case_sha256": "1a4bb310fd6e4edb385ed13e1b56625ccb8c33f98a34258cb9c8aa1d6fefb771",
      "actor_ref": "jason-local",
      "content_decision": "accept",
      "label_decision": "accept",
      "durable_sanitized_git": true,
      "accepted_at": "2026-09-29T01:29:39.263Z"
    },
    {
      "case_id": "s1-ambiguous-05",
      "revision": 1,
      "case_sha256": "b8932594b4b7cf8960773ad12f45f744c372e2bbb742b4d2640373b06a1d306f",
      "actor_ref": "jason-local",
      "content_decision": "accept",
      "label_decision": "accept",
      "durable_sanitized_git": true,
      "accepted_at": "2026-09-29T01:29:39.263Z"
    }
  ]
}
