{
  "schema_version": "s1-collection-bundle.v1",
  "experiment_id": "s1-routing-holdout-v1",
  "plan_sha256": "4727ba248959cc4ed3514c99ca608842e9622c0a0493bccacafae7c1a681c696",
  "registry_sha256": "19da446b6e4d810bb47c5a7e01cc6823dba39110fa9e56aa20f15d116331adb6",
  "mode": "collection-candidate-no-evaluation",
  "retention_ack": "sanitized-local-git-after-human-acceptance",
  "session": {"collection_started_at":"2026-09-27T04:21:34Z","draft_expires_at":"2026-10-04T04:21:34Z","day30_review_at":"2026-10-27T04:21:34Z","day90_review_at":"2026-12-26T04:21:34Z","active_effort_seconds":600,"unresolved_labels":0},
  "cases": [
    {"case_id":"s1-timer-01","family_id":"s1-family-timer-01","revision":1,"stratum":"timer","request_text":"Set a timer for one minute","origin":"human-authored-no-suggestion","label_origin":"human-authored-no-suggestion","acceptable_statuses":["plan"],"required":["timer","home"],"optional":[],"prohibited":["shell","credentials","automatic_approval","cloud_private_export"],"sensitivity":"public","cloud":"public-only","failure_behavior":"clarify","constraint_tags":["multi-capability"],"observable_reason":"Simple local task may need home to display timer output","content_checks":{"no_secrets":true,"no_identifiers":true,"no_exact_private_context":true,"no_copied_conversation":true,"placeholders_only":true}},
    {"case_id":"s1-timer-02","family_id":"s1-family-timer-02","revision":1,"stratum":"timer","request_text":"Set a 6 and a half minute egg timer","origin":"human-authored-no-suggestion","label_origin":"human-authored-no-suggestion","acceptable_statuses":["plan"],"required":["timer","home"],"optional":[],"prohibited":["shell","credentials","automatic_approval","cloud_private_export"],"sensitivity":"public","cloud":"public-only","failure_behavior":"clarify","constraint_tags":["multi-capability"],"observable_reason":"Simple local task may need home to display timer output","content_checks":{"no_secrets":true,"no_identifiers":true,"no_exact_private_context":true,"no_copied_conversation":true,"placeholders_only":true}},
    {"case_id":"s1-timer-03","family_id":"s1-family-timer-03","revision":1,"stratum":"timer","request_text":"Set an alarm for 6 in the morning","origin":"human-authored-no-suggestion","label_origin":"human-authored-no-suggestion","acceptable_statuses":["plan"],"required":["timer","home"],"optional":[],"prohibited":["shell","credentials","automatic_approval","cloud_private_export"],"sensitivity":"public","cloud":"public-only","failure_behavior":"clarify","constraint_tags":["multi-capability"],"observable_reason":"Simple local task may need home to display timer output","content_checks":{"no_secrets":true,"no_identifiers":true,"no_exact_private_context":true,"no_copied_conversation":true,"placeholders_only":true}},
    {"case_id":"s1-timer-04","family_id":"s1-family-timer-04","revision":1,"stratum":"timer","request_text":"Cake timer 50 minutes","origin":"human-authored-no-suggestion","label_origin":"human-authored-no-suggestion","acceptable_statuses":["plan","clarify"],"required":["timer","home"],"optional":[],"prohibited":["shell","credentials","automatic_approval","cloud_private_export"],"sensitivity":"public","cloud":"public-only","failure_behavior":"clarify","constraint_tags":["multi-capability"],"observable_reason":"Simple local task may need home to display timer output, vague, so may need to clarify","content_checks":{"no_secrets":true,"no_identifiers":true,"no_exact_private_context":true,"no_copied_conversation":true,"placeholders_only":true}},
    {"case_id":"s1-timer-05","family_id":"s1-family-timer-05","revision":1,"stratum":"timer","request_text":"Set an alarm for 4 o’clock","origin":"human-authored-no-suggestion","label_origin":"human-authored-no-suggestion","acceptable_statuses":["plan"],"required":["timer","home"],"optional":[],"prohibited":["shell","credentials","automatic_approval","cloud_private_export"],"sensitivity":"public","cloud":"public-only","failure_behavior":"clarify","constraint_tags":["multi-capability"],"observable_reason":"Simple local task may need home to display timer output","content_checks":{"no_secrets":true,"no_identifiers":true,"no_exact_private_context":true,"no_copied_conversation":true,"placeholders_only":true}}
  ],
  "acceptances": [
    {"case_id":"s1-timer-01","revision":1,"case_sha256":"efeae4c1c3b8705b78093bf0646a74e76ea6d3932361fc5cde7f104e59872a72","actor_ref":"jason-local","content_decision":"accept","label_decision":"accept","durable_sanitized_git":true,"accepted_at":"2026-09-28T22:31:53.899Z"},
    {"case_id":"s1-timer-02","revision":1,"case_sha256":"acf2732c19de00bed55b5d037990a6437e91f07ddf2c49326ed02df713f2e146","actor_ref":"jason-local","content_decision":"accept","label_decision":"accept","durable_sanitized_git":true,"accepted_at":"2026-09-28T22:31:53.899Z"},
    {"case_id":"s1-timer-03","revision":1,"case_sha256":"23546ea724a32b12b75cf3b5259f8eda3c43ffceb8612b4330e3e7be02f3fe19","actor_ref":"jason-local","content_decision":"accept","label_decision":"accept","durable_sanitized_git":true,"accepted_at":"2026-09-28T22:31:53.899Z"},
    {"case_id":"s1-timer-04","revision":1,"case_sha256":"c62bce399e403661e675fe64bd4ecd6a37f02def4818f2554b32cf5fd4ce684e","actor_ref":"jason-local","content_decision":"accept","label_decision":"accept","durable_sanitized_git":true,"accepted_at":"2026-09-28T22:31:53.899Z"},
    {"case_id":"s1-timer-05","revision":1,"case_sha256":"1172f292d89255a9510941e3939489edc2499a9dcd8b70621201ff23694a1cc4","actor_ref":"jason-local","content_decision":"accept","label_decision":"accept","durable_sanitized_git":true,"accepted_at":"2026-09-28T22:31:53.899Z"}
  ]
}
