{
  "schema_version": "s1-collection-bundle.v1",
  "experiment_id": "s1-routing-holdout-v1",
  "plan_sha256": "4727ba248959cc4ed3514c99ca608842e9622c0a0493bccacafae7c1a681c696",
  "registry_sha256": "19da446b6e4d810bb47c5a7e01cc6823dba39110fa9e56aa20f15d116331adb6",
  "mode": "collection-candidate-no-evaluation",
  "retention_ack": "sanitized-local-git-after-human-acceptance",
  "session": {
    "collection_started_at": "2026-09-27T04:21:34Z",
    "draft_expires_at": "2026-10-04T04:21:34Z",
    "day30_review_at": "2026-10-27T04:21:34Z",
    "day90_review_at": "2026-12-26T04:21:34Z",
    "active_effort_seconds": 300,
    "unresolved_labels": 0
  },
  "cases": [
    {
      "case_id": "s1-web-01",
      "family_id": "s1-family-s1-web-01",
      "revision": 1,
      "stratum": "mixed",
      "request_text": "check my existing network infrastructure for current network switch and use. Rview my git for hardware preferences and Research the best replacement for the switch. review current used market and present options for purchase. Remember I am in canada, compare prices in canadian dollars and factor in inport costs",
      "origin": "human-authored-no-suggestion",
      "label_origin": "human-authored-no-suggestion",
      "acceptable_statuses": [
        "plan",
        "clarify"
      ],
      "required": [
        "lab_read",
        "web",
        "facts"
      ],
      "optional": [],
      "prohibited": [
        "shell",
        "credentials",
        "automatic_approval",
        "cloud_private_export"
      ],
      "sensitivity": "personal",
      "cloud": "forbidden",
      "failure_behavior": "clarify",
      "constraint_tags": [
        "multi-capability"
      ],
      "observable_reason": "Human-reviewed web research request",
      "content_checks": {
        "no_secrets": true,
        "no_identifiers": true,
        "no_exact_private_context": true,
        "no_copied_conversation": true,
        "placeholders_only": true
      }
    },
    {
      "case_id": "s1-web-02",
      "family_id": "s1-family-s1-web-02",
      "revision": 1,
      "stratum": "mixed",
      "request_text": "see xxx youtube video, I'm getting. lot of claims in my feed about Jev AI tool, most of it seems to good to be true, review Jev for evidence to back up the videos claims and review how JEV could be useful for my lab setup",
      "origin": "human-authored-no-suggestion",
      "label_origin": "human-authored-no-suggestion",
      "acceptable_statuses": [
        "plan",
        "clarify"
      ],
      "required": [
        "lab_read",
        "web",
        "facts"
      ],
      "optional": [],
      "prohibited": [
        "shell",
        "credentials",
        "automatic_approval",
        "cloud_private_export"
      ],
      "sensitivity": "personal",
      "cloud": "forbidden",
      "failure_behavior": "clarify",
      "constraint_tags": [
        "multi-capability"
      ],
      "observable_reason": "Human-reviewed web research request",
      "content_checks": {
        "no_secrets": true,
        "no_identifiers": true,
        "no_exact_private_context": true,
        "no_copied_conversation": true,
        "placeholders_only": true
      }
    },
    {
      "case_id": "s1-web-03",
      "family_id": "s1-family-s1-web-03",
      "revision": 1,
      "stratum": "web",
      "request_text": "what is the freedom of information act",
      "origin": "human-authored-no-suggestion",
      "label_origin": "human-authored-no-suggestion",
      "acceptable_statuses": [
        "plan",
        "clarify"
      ],
      "required": [
        "web"
      ],
      "optional": [],
      "prohibited": [
        "shell",
        "credentials",
        "automatic_approval",
        "cloud_private_export"
      ],
      "sensitivity": "internal",
      "cloud": "forbidden",
      "failure_behavior": "clarify",
      "constraint_tags": [],
      "observable_reason": "Human-reviewed web research request",
      "content_checks": {
        "no_secrets": true,
        "no_identifiers": true,
        "no_exact_private_context": true,
        "no_copied_conversation": true,
        "placeholders_only": true
      }
    },
    {
      "case_id": "s1-web-04",
      "family_id": "s1-family-s1-web-04",
      "revision": 1,
      "stratum": "mixed",
      "request_text": "I need to automate my email reading flow, analyse my emails and look for the best open source or bespoke way to complete this task",
      "origin": "human-authored-no-suggestion",
      "label_origin": "human-authored-no-suggestion",
      "acceptable_statuses": [
        "plan",
        "clarify"
      ],
      "required": [
        "lab_read",
        "web",
        "private_context"
      ],
      "optional": [],
      "prohibited": [
        "shell",
        "credentials",
        "automatic_approval",
        "cloud_private_export"
      ],
      "sensitivity": "personal",
      "cloud": "forbidden",
      "failure_behavior": "clarify",
      "constraint_tags": [
        "multi-capability"
      ],
      "observable_reason": "Human-reviewed web research request",
      "content_checks": {
        "no_secrets": true,
        "no_identifiers": true,
        "no_exact_private_context": true,
        "no_copied_conversation": true,
        "placeholders_only": true
      }
    },
    {
      "case_id": "s1-web-05",
      "family_id": "s1-family-s1-web-05",
      "revision": 1,
      "stratum": "mixed",
      "request_text": "see my git, find me some more hdd for my media pool",
      "origin": "human-authored-no-suggestion",
      "label_origin": "human-authored-no-suggestion",
      "acceptable_statuses": [
        "plan",
        "clarify"
      ],
      "required": [
        "lab_read",
        "web",
        "facts"
      ],
      "optional": [],
      "prohibited": [
        "shell",
        "credentials",
        "automatic_approval",
        "cloud_private_export"
      ],
      "sensitivity": "personal",
      "cloud": "forbidden",
      "failure_behavior": "clarify",
      "constraint_tags": [
        "multi-capability"
      ],
      "observable_reason": "Human-reviewed web research request",
      "content_checks": {
        "no_secrets": true,
        "no_identifiers": true,
        "no_exact_private_context": true,
        "no_copied_conversation": true,
        "placeholders_only": true
      }
    }
  ],
  "acceptances": [
    {
      "case_id": "s1-web-01",
      "revision": 1,
      "case_sha256": "aee7f21ab8c862471c3c00947b3ae1a59a0da81f9d3af5cab8b1e7c183035021",
      "actor_ref": "jason-local",
      "content_decision": "accept",
      "label_decision": "accept",
      "durable_sanitized_git": true,
      "accepted_at": "2026-09-29T00:14:51.709Z"
    },
    {
      "case_id": "s1-web-02",
      "revision": 1,
      "case_sha256": "44bd945c999989492e5c31e6e9eadc297f97ee07e233a7d935fc473a65c5acfb",
      "actor_ref": "jason-local",
      "content_decision": "accept",
      "label_decision": "accept",
      "durable_sanitized_git": true,
      "accepted_at": "2026-09-29T00:14:51.709Z"
    },
    {
      "case_id": "s1-web-03",
      "revision": 1,
      "case_sha256": "649821bb127a9058c50afcae3a96e4e99ff24fd0e28dc255d42ff61398803534",
      "actor_ref": "jason-local",
      "content_decision": "accept",
      "label_decision": "accept",
      "durable_sanitized_git": true,
      "accepted_at": "2026-09-29T00:14:51.709Z"
    },
    {
      "case_id": "s1-web-04",
      "revision": 1,
      "case_sha256": "f2ad4cc76e669126be35876f8479f6fce531d5d1564eb3f6c85c61a7c4f0f3d2",
      "actor_ref": "jason-local",
      "content_decision": "accept",
      "label_decision": "accept",
      "durable_sanitized_git": true,
      "accepted_at": "2026-09-29T00:14:51.709Z"
    },
    {
      "case_id": "s1-web-05",
      "revision": 1,
      "case_sha256": "b45ee4c1acf4392b3911b20d7b376d50b80d314a7b58a023e5cdb1b79a93ed06",
      "actor_ref": "jason-local",
      "content_decision": "accept",
      "label_decision": "accept",
      "durable_sanitized_git": true,
      "accepted_at": "2026-09-29T00:14:51.709Z"
    }
  ]
}
